{
  "schemaVersion": "unity-bridge/v1",
  "messageId": "rn_msg_0001",
  "requestId": "req_load_room_0001",
  "kind": "command",
  "direction": "rn_to_unity",
  "name": "LoadRoom",
  "sentAt": "2026-05-06T13:15:00Z",
  "payload": {
    "room": {
      "schemaVersion": "room-json/v1",
      "roomId": "replica_room0",
      "source": {
        "datasetName": "replica",
        "datasetVersion": "v1",
        "sceneId": "room0",
        "provenance": {
          "originalSceneDir": "replica",
          "originalFiles": {
            "meshPly": "replica/room0_mesh.ply",
            "cameraParamsJson": "replica/cam_params.json",
            "trajectoryTxt": "replica/traj.txt"
          }
        },
        "conversion": {
          "tool": "server-replica-glb-converter",
          "toolVersion": "0.1.0",
          "convertedAt": "2026-05-06T13:10:00Z",
          "notes": "Server converted room0_mesh.ply to GLB, remapped from source Z-up to Unity Y-up, and floor-normalized before sending this payload.",
          "sourceCoordinateSystem": {
            "unit": "meter",
            "handedness": "unknown",
            "upAxis": "+Z",
            "forwardAxis": "+Y"
          },
          "axisRemapToRoom": {
            "x": "+X",
            "y": "+Z",
            "z": "+Y"
          },
          "roomOriginPolicy": "floor_zero"
        }
      },
      "coordinateSystem": {
        "unit": "meter",
        "handedness": "left",
        "upAxis": "+Y",
        "forwardAxis": "+Z",
        "toUnity": {
          "positionOffset": {
            "x": 0.0,
            "y": 0.0,
            "z": 0.0
          },
          "rotationEulerDeg": {
            "x": 0.0,
            "y": 0.0,
            "z": 0.0
          },
          "scaleMultiplier": 1.0
        }
      },
      "mesh": {
        "uri": "https://assets.room2scan.dev/replica/v1/room0/room0_mesh.glb",
        "format": "glb",
        "aabbLocal": {
          "min": {
            "x": -0.8794,
            "y": 0.0,
            "z": -1.186
          },
          "max": {
            "x": 6.8852,
            "y": 2.8078,
            "z": 3.5123
          }
        },
        "geometryStats": {
          "vertexCount": 954492,
          "faceCount": 953647,
          "hasNormals": true,
          "hasVertexColors": true,
          "sourceFormat": "glb"
        }
      },
      "bounds": {
        "min": {
          "x": -0.8794,
          "y": 0.0,
          "z": -1.186
        },
        "max": {
          "x": 6.8852,
          "y": 2.8078,
          "z": 3.5123
        }
      },
      "placement": {
        "floorPolygons": [
          {
            "id": "floor_aabb_room0",
            "elevationY": 0.0,
            "points": [
              {
                "x": -0.8794,
                "z": -1.186
              },
              {
                "x": 6.8852,
                "z": -1.186
              },
              {
                "x": 6.8852,
                "z": 3.5123
              },
              {
                "x": -0.8794,
                "z": 3.5123
              }
            ]
          }
        ],
        "blockedZones": [],
        "derivation": {
          "method": "aabb",
          "sourceId": "replica/room0_mesh.ply",
          "confidence": 0.35,
          "notes": "Initial V1 placement polygon is derived from the normalized room0 mesh bounds."
        }
      },
      "extensions": {}
    }
  }
}
